{
  "type": "cli-tool",
  "version": "1.0.0",
  "description": "Opinionated CLI tool pipeline — from argument parsing to distribution",
  "parameters": {
    "required": [
      {
        "name": "project_name",
        "type": "string",
        "description": "Project name"
      },
      {
        "name": "description",
        "type": "string",
        "description": "One-line project description"
      }
    ],
    "optional": [
      {
        "name": "repo",
        "type": "string",
        "default": "detect",
        "description": "GitHub repo (owner/name)"
      },
      {
        "name": "stack",
        "type": "string",
        "default": "unknown",
        "description": "Tech stack hint"
      },
      {
        "name": "prefix",
        "type": "string",
        "default": "v1",
        "description": "Milestone naming prefix"
      }
    ]
  },
  "milestones": [
    {
      "name": "{prefix}: Foundation",
      "description": "Project structure, argument parsing, and command routing",
      "phases": [
        {
          "number": 1,
          "name": "CLI Setup",
          "description": "Initialize project, configure argument parser, define command structure and help system",
          "gsd_route": "plan-phase",
          "issues": [
            {
              "title": "Set up {project_name} project structure",
              "description": "Initialize the CLI project with package manager, entry point, bin configuration, and directory layout",
              "labels": ["setup", "phase-1"]
            },
            {
              "title": "Configure argument parser and command routing",
              "description": "Set up CLI framework with subcommand routing, global flags, argument validation, and error handling",
              "labels": ["feature", "cli", "phase-1"]
            },
            {
              "title": "Create help system and usage documentation",
              "description": "Implement --help output for all commands, man page generation, and usage examples in README",
              "labels": ["docs", "cli", "phase-1"]
            }
          ]
        },
        {
          "number": 2,
          "name": "Core Commands",
          "description": "Implement primary commands with input validation and structured output formatting",
          "gsd_route": "plan-phase",
          "issues": [
            {
              "title": "Implement primary commands",
              "description": "Build the core commands that deliver {project_name}'s main functionality: {description}",
              "labels": ["feature", "core", "phase-2"]
            },
            {
              "title": "Add input validation and error handling",
              "description": "Validate all command inputs, provide helpful error messages, and handle edge cases gracefully",
              "labels": ["feature", "validation", "phase-2"]
            },
            {
              "title": "Build output formatting",
              "description": "Support multiple output formats (JSON, table, plain text) with --format flag and colored terminal output",
              "labels": ["feature", "output", "phase-2"]
            }
          ]
        }
      ]
    },
    {
      "name": "{prefix}: Features",
      "description": "Advanced features including configuration, interactive mode, and integrations",
      "phases": [
        {
          "number": 3,
          "name": "Advanced Features",
          "description": "Add configuration file support, interactive prompts, and external service integrations",
          "gsd_route": "plan-phase",
          "issues": [
            {
              "title": "Add configuration file support",
              "description": "Implement config file discovery (project-local and global), parsing, validation, and merge with CLI flags",
              "labels": ["feature", "config", "phase-3"]
            },
            {
              "title": "Implement interactive mode and prompts",
              "description": "Add interactive prompts for missing required inputs, confirmation dialogs, and guided workflows",
              "labels": ["feature", "interactive", "phase-3"]
            },
            {
              "title": "Build external service integrations",
              "description": "Connect to external APIs or services required by {project_name}, with authentication and retry logic",
              "labels": ["feature", "integration", "phase-3"]
            }
          ]
        }
      ]
    },
    {
      "name": "{prefix}: Ship",
      "description": "Testing, cross-platform validation, packaging, and npm publishing",
      "phases": [
        {
          "number": 4,
          "name": "Testing & Reliability",
          "description": "Comprehensive test suite, error recovery, cross-platform validation, and edge case coverage",
          "gsd_route": "plan-phase",
          "issues": [
            {
              "title": "Add unit and integration tests",
              "description": "Write tests for all commands, argument parsing, config loading, output formatting, and error paths",
              "labels": ["testing", "phase-4"]
            },
            {
              "title": "Implement error recovery and graceful degradation",
              "description": "Handle network failures, missing permissions, invalid configs, and interrupted operations with clear user messaging",
              "labels": ["reliability", "phase-4"]
            },
            {
              "title": "Test cross-platform compatibility",
              "description": "Verify functionality on macOS, Linux, and Windows; fix path handling, shell escaping, and terminal compatibility issues",
              "labels": ["testing", "compatibility", "phase-4"]
            }
          ]
        },
        {
          "number": 5,
          "name": "Distribution",
          "description": "Package for npm publishing, write installation docs, and prepare for release",
          "gsd_route": "quick",
          "issues": [
            {
              "title": "Configure npm packaging and publishing",
              "description": "Set up package.json bin field, bundling, npm publish config, and GitHub release automation",
              "labels": ["deployment", "npm", "phase-5"]
            },
            {
              "title": "Write installation and usage documentation",
              "description": "Complete README with install instructions (npm, npx), quickstart guide, full command reference, and examples",
              "labels": ["docs", "phase-5"]
            }
          ]
        }
      ]
    }
  ]
}
